{
  "version": "v0.5",
  "model": "linked-service-diet",
  "purpose": "Define the temporary-link scan used to identify unnecessary surfaces in an independent service and archive them without central runtime ownership.",
  "scan_axes": [
    {
      "axis_id": "dead-surface",
      "question": "Is this file, folder, or flow no longer used by the current runtime path?"
    },
    {
      "axis_id": "duplicate-surface",
      "question": "Does this surface duplicate another active surface without providing a distinct operational role?"
    },
    {
      "axis_id": "stale-governance-surface",
      "question": "Does this surface still represent an old governance path that is no longer canonical?"
    },
    {
      "axis_id": "archive-safe",
      "question": "Can this surface be archived without breaking the live runtime or the current governance kernel?"
    }
  ],
  "required_outputs": [
    "scan_receipt",
    "archive_candidates_ref",
    "keep_list_ref",
    "risk_note_ref"
  ],
  "archive_policy": {
    "allowed_actions": [
      "mark-for-archive",
      "move-to-local-archive",
      "retain-as-active"
    ],
    "forbidden_actions": [
      "delete-live-runtime-surface-without-receipt",
      "archive-governance-kernel-required-entry",
      "archive-without-rollback-note"
    ]
  },
  "completion_rule": {
    "required_status": "diet-scanned",
    "linked_service_fields": [
      "diet_status",
      "archive_candidates_ref"
    ]
  },
  "hard_rules": [
    "Service diet must reduce clutter without breaking the live runtime path.",
    "A surface may be marked for archive only if the scan receipt and risk note both exist.",
    "Central governance may direct the archive decision but must not take custody of the archived runtime itself."
  ]
}
